{
  "spec_version": "1.0",
  "description": "Curated high-leverage trigger → load hint map. Source of truth for both the Claude dispatcher and Cursor beforeSubmitPrompt (via 09-tools/prompt_route.py). Insertion order IS emission priority.",
  "templates": {
    "FOUNDATION_ROUTE": "FOUNDATIONS FIRST: 03-skills/design-foundations/SKILL.md + 03-skills/found-color/SKILL.md + 03-skills/a11y-visual/SKILL.md + 03-skills/uid-color-for-ui/SKILL.md (system-agnostic color/UX/a11y baseline). Then resolve within the TARGET design system's OWN tokens/variables (read its DESIGN.md / connected Figma libraries); if the target system lacks a needed token, derive minimally within its constraints and add the gap to the backlog — do not import another system's conventions. Token gaps are backloggable; a11y compliance is not deferrable — the delivered artifact must pass now.",
    "ARTIFACT_ROUTE": "02-shared-references/delivery-playbooks/06-research-and-design-artifacts.md — SELECT the right research/design artifact (JTBD/persona/journey map/service blueprint/user story/use case/user flow) via its selection guide, respect the order-of-operations, and AUTHOR to the rules: spell everything out (no cryptic code/ticket references), define every domain term in plain English, persona-anchor at the user level, service-design altitude at the system level. Context profile first.",
    "FIGMA_GENERATE_ROUTE": "BEFORE vendor plugin skills (figma-use / figma-generate-library / figma-generate-design): load 03-skills/figma/SKILL.md (hub; plugins = mechanics only) → 03-skills/design-engineer/SKILL.md → component sets/variants: 03-skills/figma-component-generation/SKILL.md; screens: 03-skills/figma-canvas-designer/SKILL.md. Knowledge: 08-knowledge/design/figma-ds-surface-authoring.md. HARD GATE: bind fill/stroke/text/spacing/radius to the TARGET SYSTEM's semantic + theme/mode tokens (Light/Dark, Density) — never Color/* primitives. Missing token → create a semantic alias in that system, then bind. skillNames on use_figma is telemetry and does not load skills. Existing file, recipe, wrap, instance, and small edit are not exemptions. After each component: python3 09-tools/figma-bind-probe.py --capture; exit 2 is not a pass.",
    "VENDOR_ARTIFACT_ROUTE": "03-skills/artifact-ingest/SKILL.md then 06-context/memory/decision-vendor-surface-artifacts.md + 02-shared-references/workspace-ontology.md vendor-surface row — write the vault file (or copy-ready path on web); Cursor .canvas.tsx is dual-home (`cursor-externalize.py`); employer canvases go to that repo's canvases/ never this vault; clipboard/inbox: `artifact-ingest.py`; HTML stays HTML per artifact-standards."
  },
  "routes": {
    "audit": "01-frameworks/06-qa-operating-model.md — pre-output gate: load BEFORE the work",
    "review": "01-frameworks/06-qa-operating-model.md — pre-output gate: load BEFORE the work",
    "critique": "01-frameworks/06-qa-operating-model.md — pre-output gate: load BEFORE the work",
    "qa pass": "01-frameworks/06-qa-operating-model.md — pre-output gate: load BEFORE the work",
    "refine": "01-frameworks/06-qa-operating-model.md — pre-output gate: load BEFORE the work",
    "legion": "03-skills/legion-project/SKILL.md + appropriate hub (lead-game-designer / lead-art-director / lead-game-developer)",
    "bobiverse": "03-skills/legion-project/SKILL.md",
    "centric": "Centric PLM project context — see 06-context/project-context.md; ds-advisor hub",
    "data table": "Data table cell anatomy work — cross-reference 06-context/artifact-registry.md; knowledge: 08-knowledge/design/enterprise-saas-design-patterns.md",
    "icon font": "03-skills/variable-icon-font-architect/SKILL.md + math spokes",
    "centricsymbols": "03-skills/variable-icon-font-architect/SKILL.md",
    "omni": "03-skills/omni-project/SKILL.md",
    "workspace brain": "07-projects/19-workspace-brain/ — standing home for workspace-subject sessions; read its SESSION-STATE.md Live handoff",
    "workspace fix": "07-projects/19-workspace-brain/ — standing home for workspace-subject sessions; read its SESSION-STATE.md Live handoff",
    "workspace validation": "07-projects/19-workspace-brain/ — standing home for workspace-subject sessions; read its SESSION-STATE.md Live handoff",
    "vendor artifact": "$VENDOR_ARTIFACT_ROUTE",
    "llm canvas": "$VENDOR_ARTIFACT_ROUTE",
    "chatgpt canvas": "$VENDOR_ARTIFACT_ROUTE",
    "claude artifact": "$VENDOR_ARTIFACT_ROUTE",
    "html artifact": "$VENDOR_ARTIFACT_ROUTE",
    "clipboard ingest": "$VENDOR_ARTIFACT_ROUTE",
    "externalize canvas": "$VENDOR_ARTIFACT_ROUTE",
    "error correction": "08-knowledge/research/agentic-error-correction-foundations.md + 07-projects/19-workspace-brain/SESSION-STATE.md — independent measurement or refuse the done-claim; do not add a parallel brain",
    "verification loop": "08-knowledge/research/agentic-error-correction-foundations.md + 01-frameworks/06-qa-operating-model.md + 01-frameworks/11-anticipatory-failure-analysis.md — loops need an independent detector",
    "agent reliability": "08-knowledge/research/agentic-error-correction-foundations.md + 07-projects/19-workspace-brain/ — workstream detector registry",
    "generate-verify": "08-knowledge/research/agentic-error-correction-foundations.md — generation-verification gap; same-model critique is polish",
    "self-correct": "08-knowledge/research/agentic-error-correction-foundations.md — Self-Refine is not a prove-gate",
    "system pack": "03-skills/visual-reference-replication/SKILL.md + 07-projects/20-lcars-generative-interface/docs/program-thesis.md — pipeline vs pack separation",
    "literal match": "03-skills/visual-reference-replication/SKILL.md + native-visual-eval + visual-prove-engine — Construction IR before code; Literal prove-gate runs `vqa prove`",
    "prove this build": "03-skills/visual-prove-engine/SKILL.md — cuespec + measured/attested split; verdicts come from probes, never prose",
    "cuespec": "03-skills/visual-prove-engine/SKILL.md — author from reference scouting; record derivation in _provenance",
    "measured verdict": "03-skills/visual-prove-engine/SKILL.md + 08-knowledge/cross-domain/measured-visual-verdicts.md — four conditions for a trustworthy visual verdict",
    "rank builds": "03-skills/visual-prove-engine/SKILL.md — `vqa compare` closeness ranking + `vqa score` improvement ledger",
    "visual regression gate": "03-skills/visual-prove-engine/SKILL.md — `vqa score --enforce` exits non-zero on regression",
    "jank": "03-skills/visual-prove-engine/SKILL.md — `vqa motion` stutter/flicker/settle + vsync timing with timestamps",
    "play-prove": "03-skills/play-prove/SKILL.md — headless simulation/balance (altitude G); not a vqa subcommand",
    "dominant strategy": "03-skills/play-prove/SKILL.md — no_dominant_strategy assertion on adapter metrics",
    "flip metric": "03-skills/visual-prove-engine/SKILL.md — altitude B; `vqa compare` + flip_region; degrades to flip-lite",
    "gltf validator": "03-skills/visual-prove-engine/SKILL.md — `vqa mesh`; fail closed on Error",
    "vgpu": "03-skills/vgpu-webgpu/SKILL.md — default web GPU runtime; MCP https://vgpu.sh/api/mcp + `npx vgpu`; existing Three stays on adapter-webgpu-three",
    "vgpu.sh": "03-skills/vgpu-webgpu/SKILL.md — default web GPU runtime (vgpu)",
    "wgsl": "03-skills/vgpu-webgpu/SKILL.md — new web shaders; GLSL on an existing Three tree → glsl-shader-architect",
    "web 3d": "03-skills/vgpu-webgpu/SKILL.md — runtime selection; DCC → lead-3d-designer; glTF → 3d-asset-pipeline",
    "webgpu shader": "03-skills/vgpu-webgpu/SKILL.md — greenfield WebGPU; Three WebGPURenderer/TSL → webgpu-advanced-rendering",
    "canvas webgpu": "03-skills/vgpu-webgpu/SKILL.md",
    "headless webgpu": "03-skills/vgpu-webgpu/SKILL.md — `npx vgpu doctor` / Dawn / mock",
    "gltf-transform": "03-skills/3d-asset-pipeline/SKILL.md — optimize GLB before web delivery",
    "threejs-devtools": "03-skills/adapter-webgpu-three/SKILL.md — live Three/R3F inspect; not for greenfield vgpu",
    "boolean csg": "03-skills/web-3d-extensions/SKILL.md — conversation/intent-valid; chisel when the verb is generate",
    "csg to gltf": "03-skills/web-3d-extensions/SKILL.md",
    "without blender": "03-skills/web-3d-extensions/SKILL.md — CSG/chisel path when the job is a solid without DCC",
    "without opening blender": "03-skills/web-3d-extensions/SKILL.md — CSG/chisel path when the job is a solid without DCC",
    "godot editor": "03-skills/web-3d-extensions/SKILL.md — research without editor; mutate only if Godot is open",
    "drive godot editor": "03-skills/web-3d-extensions/SKILL.md — research without editor; mutate only if Godot is open",
    "drive unity editor": "03-skills/adapter-unity-hdrp/SKILL.md + 03-skills/web-3d-extensions/SKILL.md",
    "same scene three babylon": "03-skills/web-3d-extensions/SKILL.md — maige-3d live compare",
    "chisel mcp": "03-skills/web-3d-extensions/SKILL.md — headless CSG → glTF",
    "maige-3d": "03-skills/web-3d-extensions/SKILL.md — live Three/A-Frame/Babylon/R3F canvas MCP",
    "mcp-webgpu": "03-skills/web-3d-extensions/SKILL.md — maige-3d-mcp; demo canvas not a ship renderer",
    "godot mcp": "03-skills/web-3d-extensions/SKILL.md — Godot 4.5+ editor bridge",
    "unity mcp": "03-skills/adapter-unity-hdrp/SKILL.md + 03-skills/web-3d-extensions/SKILL.md — Coplay or official Unity editor bridge",
    "agentbridge": "03-skills/adapter-unreal/SKILL.md + 03-skills/web-3d-extensions/SKILL.md — UE 5.6 editor MCP; not required for northstar stills",
    "input-to-photon": "03-skills/visual-prove-engine/SKILL.md — `vqa motion` photon spec; first pixel change after inject",
    "recreate this screen": "03-skills/visual-reference-replication/SKILL.md — lock Literal; northstar + IR + cue matrix before implement",
    "match this reference": "03-skills/visual-reference-replication/SKILL.md — lock Literal; refuse VLM prose as measurement",